{
  "mode": "architecture",
  "theme": "showcase",
  "title": "Source-Evidence Architecture Map",
  "summary": "Architecture nodes and routes carry explicit source evidence so the diagram can defend its claims.",
  "nodes": [
    {
      "id": "repo",
      "label": "Repository",
      "subtitle": "Local checkout",
      "kind": "memory",
      "x": 120,
      "y": 240,
      "evidence": {
        "source": "examples/repo-evidence-map.json",
        "line": 1,
        "commit": "4382db4",
        "confidence": "high"
      }
    },
    {
      "id": "scanner",
      "label": "Evidence Scanner",
      "subtitle": "File and line hints",
      "kind": "agent",
      "x": 360,
      "y": 160,
      "evidence": {
        "source": "scripts/render_architecture.py",
        "line": 78,
        "commit": "4382db4",
        "confidence": "medium"
      }
    },
    {
      "id": "spec",
      "label": "Evidence Spec",
      "subtitle": "Nodes and edges",
      "kind": "service",
      "x": 600,
      "y": 160
    },
    {
      "id": "artifact",
      "label": "Review Artifact",
      "subtitle": "Readable map",
      "kind": "llm",
      "x": 840,
      "y": 160
    },
    {
      "id": "receipt",
      "label": "Proof Receipt",
      "subtitle": "Evidence counts",
      "kind": "memory",
      "x": 1080,
      "y": 240,
      "evidence": {
        "source": "examples/repo-evidence-map.html.receipt.json",
        "line": 1,
        "commit": "4382db4",
        "confidence": "high"
      }
    },
    {
      "id": "reviewer",
      "label": "Reviewer",
      "subtitle": "Trusts cited claims",
      "kind": "service",
      "x": 600,
      "y": 400
    }
  ],
  "edges": [
    {
      "from": "repo",
      "to": "scanner",
      "kind": "primary-data",
      "label": "read",
      "source_side": "top",
      "target_side": "left"
    },
    {
      "from": "scanner",
      "to": "spec",
      "kind": "memory-write",
      "label": "cite"
    },
    {
      "from": "spec",
      "to": "artifact",
      "kind": "primary-data",
      "label": "render"
    },
    {
      "from": "artifact",
      "to": "receipt",
      "kind": "memory-write",
      "label": "prove",
      "target_side": "top"
    },
    {
      "from": "receipt",
      "to": "reviewer",
      "kind": "control",
      "label": "audit",
      "source_side": "bottom",
      "target_side": "right",
      "via": [
        {
          "x": 1080,
          "y": 400
        }
      ],
      "label_segment": 1
    }
  ]
}
